<?xml version="1.0" encoding="UTF-8" ?>
<books xmlns="http://bsuir.by/Bookshop"
         xmlns:xsi="http://www.w3.org/2001/XMLSchema-instance"
         xsi:schemaLocation="http://bsuir.by/Bookshop Bookshop.xsd">
    <book>
        <name>Война и мир</name>
        <author>Лев Николаевич Толстой</author>
        <genre>Novel</genre>
        <price>3</price>
    </book>

    <book>
        <name>Братья Карамазовы</name>
        <author>Федор Михайлович Достоевский</author>
        <genre>Novel</genre>
        <price>5</price>
    </book>

    <book>
        <name>Краткая история человечества</name>
        <author>Юваль Харари</author>
        <genre>SciFi</genre>
        <price>16</price>
    </book>

</books>